{"expiresAtMs":1789729055736,"issuedAtMs":1789728995636,"maxOfflineAgeMs":60000,"publishers":[{"executionModes":["ipc"],"id":"org.aquiero.alica","keyIds":["sha256:d83bce2977397ae7b7039da2b351aafb7f4e1140e5c9694939ec7022cb85a34c"]}],"rootKeyIds":["sha256:286c370307ce0f48bfc3c5e978821721073ceae315d2892486ab729ba35b5c65"],"schemaVersion":"alica.trust-policy/v1","version":1}