{"expiresAtMs":1789744901662,"issuedAtMs":1789744841562,"maxOfflineAgeMs":60000,"publishers":[{"executionModes":["ipc"],"id":"org.aquiero.alica","keyIds":["sha256:d7ba004e4bab8c18143894719cc2d535240b7e2e822bbbd530bb4084beedfaf7"]}],"rootKeyIds":["sha256:504234ea5086de51f137a0d900b359bb4344dd86d9dd4f769673f0133052c3c7"],"schemaVersion":"alica.trust-policy/v1","version":1}