{"expiresAtMs":1789731392299,"issuedAtMs":1789731332199,"maxOfflineAgeMs":60000,"publishers":[{"executionModes":["ipc"],"id":"org.aquiero.alica","keyIds":["sha256:44b39eb8c5ce4e48cfa882c2d659f897dcf6fc13cb5da8181ad90ca7c6ff0b0a"]}],"rootKeyIds":["sha256:6c407ba55247ab160f3b7c2ae7b628cb3a89585fcecc031ee960a6a51d588131"],"schemaVersion":"alica.trust-policy/v1","version":1}