{"expiresAtMs":1789718583197,"issuedAtMs":1789718523097,"maxOfflineAgeMs":60000,"publishers":[{"executionModes":["ipc"],"id":"org.aquiero.alica","keyIds":["sha256:c58853c3c55c0f197d059c702f75554ea660f6b89612e016e4dadf6b5aaea8dd"]}],"rootKeyIds":["sha256:fa48287fcc54250bf103127d2dee862083fab1e14b03d17cb14beb246a1443e8"],"schemaVersion":"alica.trust-policy/v1","version":1}