{"expiresAtMs":1789719402184,"issuedAtMs":1789719342084,"maxOfflineAgeMs":60000,"publishers":[{"executionModes":["ipc"],"id":"org.aquiero.alica","keyIds":["sha256:246783d125942f676782b4741cb339244865dd7da862bc34ea2574cf6bee906a"]}],"rootKeyIds":["sha256:9c7f3f16df606b2b3f38927b14dcd7336ae510d0afa46d607dc19caab236f339"],"schemaVersion":"alica.trust-policy/v1","version":1}