{"expiresAtMs":1789717822984,"issuedAtMs":1789717762884,"maxOfflineAgeMs":60000,"publishers":[{"executionModes":["ipc"],"id":"org.aquiero.alica","keyIds":["sha256:6ab1fb4a7f03d1a0a6b31604b42d0eb65cdb7aaf7e2d876357cd13402e99f059"]}],"rootKeyIds":["sha256:be7b3cffcd2b592bec922f31de9bec214781e500a1fa3b8ff2ca60c184925319"],"schemaVersion":"alica.trust-policy/v1","version":1}