{"expiresAtMs":1789744417351,"issuedAtMs":1789744357251,"maxOfflineAgeMs":60000,"publishers":[{"executionModes":["ipc"],"id":"org.aquiero.alica","keyIds":["sha256:ee02677b2b42e0bc49510b3e3de11d18c6a1f1f6b77349c5d798c8ff41feda3f"]}],"rootKeyIds":["sha256:3756f67dc588e6ee140ccfa6ff37303a2eef34ef0d509ccedc175d3f38918972"],"schemaVersion":"alica.trust-policy/v1","version":1}