{"expiresAtMs":1789731341330,"issuedAtMs":1789731281230,"maxOfflineAgeMs":60000,"publishers":[{"executionModes":["ipc"],"id":"org.aquiero.alica","keyIds":["sha256:ae6fc1afa45b4e104c458056fe786ec1346678bbc2fbbbd9dc406a5f97fa672a"]}],"rootKeyIds":["sha256:69db2c6046197a19dc8d6b613554734cb40317816058d834429a617c51afbe81"],"schemaVersion":"alica.trust-policy/v1","version":1}