{"expiresAtMs":1789735442737,"issuedAtMs":1789735382637,"maxOfflineAgeMs":60000,"publishers":[{"executionModes":["ipc"],"id":"org.aquiero.alica","keyIds":["sha256:eb36e70f4b121101ec6285eacaf57f318584bf18874c4f917de9592bfbb561ef"]}],"rootKeyIds":["sha256:4da626c6d661765e043f22342273fc5743bffe92b389987fc145e322299347ce"],"schemaVersion":"alica.trust-policy/v1","version":1}